{
  "card_type_id": "corp_identity",
  "deck_limit": 1,
  "designed_by": "fantasy_flight_games",
  "faction_id": "nbn",
  "id": "haarpsichord_studios_entertainment_unleashed",
  "influence_limit": 15,
  "is_unique": false,
  "minimum_deck_size": 45,
  "side_id": "corp",
  "stripped_text": "The Runner cannot steal more than one agenda each turn.",
  "stripped_title": "Haarpsichord Studios: Entertainment Unleashed",
  "subtypes": ["division"],
  "text": "The Runner cannot steal more than one agenda each turn.",
  "title": "Haarpsichord Studios: Entertainment Unleashed"
}
