{
  "card_type_id": "hardware",
  "cost": 1,
  "deck_limit": 3,
  "designed_by": "null_signal_games",
  "faction_id": "shaper",
  "id": "airbladex_jsrf_ed",
  "influence_cost": 1,
  "is_unique": true,
  "side_id": "runner",
  "stripped_text": "When you install this hardware, load 3 power counters onto it. When it is empty, trash it. Interrupt -> Hosted power counter: Prevent 1 net damage. Use this ability only during a run. Interrupt -> Hosted power counter: Prevent a \"when encountered\" ability on a piece of ice.",
  "stripped_title": "AirbladeX (JSRF Ed.)",
  "subtypes": ["vehicle"],
  "text": "When you install this hardware, load 3 power counters onto it. When it is empty, trash it.\n[interrupt] → <strong>Hosted power counter:</strong> Prevent 1 net damage. Use this ability only during a run.\n[interrupt] → <strong>Hosted power counter:</strong> Prevent a \"when encountered\" ability on a piece of ice.",
  "title": "AirbladeX (JSRF Ed.)"
}
