{
  "card_type_id": "resource",
  "cost": 1,
  "deck_limit": 3,
  "designed_by": "null_signal_games",
  "faction_id": "criminal",
  "id": "the_back",
  "influence_cost": 4,
  "is_unique": true,
  "side_id": "runner",
  "stripped_text": "The first time each turn you use a piece of hardware during a run, place 1 power counter on this resource. click, remove this resource from the game: For each hosted power counter, choose up to 2 cards in your heap with trash abilities. Shuffle the chosen cards into your stack.",
  "stripped_title": "The Back",
  "subtypes": ["job", "location"],
  "text": "The first time each turn you use a piece of hardware during a run, place 1 power counter on this resource.\n[click], <strong>remove this resource from the game:</strong> For each hosted power counter, choose up to 2 cards in your heap with [trash] abilities. Shuffle the chosen cards into your stack.",
  "title": "The Back"
}
