{
  "card_type_id": "program",
  "cost": 3,
  "deck_limit": 3,
  "designed_by": "null_signal_games",
  "faction_id": "anarch",
  "id": "cleaver",
  "influence_cost": 2,
  "is_unique": false,
  "memory_cost": 1,
  "side_id": "runner",
  "strength": 3,
  "stripped_text": "Interface -> 1 credit: Break up to 2 barrier subroutines. 2 credits: +1 strength.",
  "stripped_title": "Cleaver",
  "subtypes": ["icebreaker", "fracter"],
  "text": "Interface â†’ <strong>1[credit]:</strong> Break up to 2 <strong>barrier</strong> subroutines.\n<strong>2[credit]:</strong> +1 strength.",
  "title": "Cleaver"
}
