{
  "card_type_id": "asset",
  "cost": 0,
  "deck_limit": 3,
  "designed_by": "fantasy_flight_games",
  "faction_id": "nbn",
  "id": "blacklist",
  "influence_cost": 1,
  "is_unique": false,
  "side_id": "corp",
  "stripped_text": "Cards cannot leave the Runner's heap for any reason.",
  "stripped_title": "Blacklist",
  "text": "Cards cannot leave the Runner's heap for any reason.",
  "title": "Blacklist",
  "trash_cost": 3
}
