{
  "card_type_id": "asset",
  "cost": 0,
  "deck_limit": 3,
  "designed_by": "fantasy_flight_games",
  "faction_id": "neutral_corp",
  "id": "ngo_front",
  "influence_cost": 0,
  "is_unique": false,
  "side_id": "corp",
  "stripped_text": "NGO Front can be advanced. trash,1 hosted advancement token: Gain 5 credits. trash,2 hosted advancement tokens: Gain 8 credits.",
  "stripped_title": "NGO Front",
  "text": "NGO Front can be advanced.\n[trash],<strong>1 hosted advancement token</strong>: Gain 5[credit].\n[trash],<strong>2 hosted advancement tokens</strong>: Gain 8[credit].",
  "title": "NGO Front",
  "trash_cost": 1
}
