{
  "card_type_id": "resource",
  "cost": 1,
  "deck_limit": 3,
  "designed_by": "fantasy_flight_games",
  "faction_id": "shaper",
  "id": "personal_workshop",
  "influence_cost": 4,
  "is_unique": false,
  "side_id": "runner",
  "stripped_text": "click: Host a program or piece of hardware from your grip on Personal Workshop and place power counters on it equal to its install cost. 1 credit: Remove 1 power counter from a hosted card. When your turn begins, remove 1 power counter from a hosted card. When there are no power counters left on a hosted card, install it, ignoring all costs.",
  "stripped_title": "Personal Workshop",
  "subtypes": ["location"],
  "text": "[click]: Host a program or piece of hardware from your grip on Personal Workshop and place power counters on it equal to its install cost.\n1[credit]: Remove 1 power counter from a hosted card.\nWhen your turn begins, remove 1 power counter from a hosted card.\nWhen there are no power counters left on a hosted card, install it, ignoring all costs.",
  "title": "Personal Workshop"
}
