{
  "advancement_requirement": 3,
  "agenda_points": 2,
  "card_type_id": "agenda",
  "deck_limit": 3,
  "designed_by": "fantasy_flight_games",
  "faction_id": "neutral_corp",
  "id": "merger",
  "influence_cost": 1,
  "is_unique": false,
  "side_id": "corp",
  "stripped_text": "Merger is worth 1 additional agenda point while in the Runner's score area.",
  "stripped_title": "Merger",
  "subtypes": ["expansion"],
  "text": "Merger is worth 1 additional agenda point while in the Runner's score area.",
  "title": "Merger"
}
