{
  "card_type_id": "operation",
  "cost": 1,
  "deck_limit": 3,
  "designed_by": "null_signal_games",
  "faction_id": "haas_bioroid",
  "id": "red_level_clearance",
  "influence_cost": 2,
  "is_unique": false,
  "side_id": "corp",
  "stripped_text": "Resolve 2 of the following in any order: * Draw 2 cards. * Gain 2 credits. * Install 1 non-agenda card from HQ. * Gain click.",
  "stripped_title": "Red Level Clearance",
  "subtypes": ["transaction"],
  "text": "Resolve 2 of the following in any order:<ul><li>Draw 2 cards.</li><li>Gain 2[credit].</li><li>Install 1 non-agenda card from HQ.</li><li>Gain [click].</li></ul>",
  "title": "Red Level Clearance"
}
