{
  "card_type_id": "event",
  "cost": 3,
  "deck_limit": 3,
  "designed_by": "fantasy_flight_games",
  "faction_id": "shaper",
  "id": "test_run",
  "influence_cost": 3,
  "is_unique": false,
  "side_id": "runner",
  "stripped_text": "Search either your stack or your heap for 1 program. (Shuffle your stack after searching it.) Install that program, ignoring all costs. When your turn ends, if that program has not been uninstalled, add it to the top of your stack.",
  "stripped_title": "Test Run",
  "text": "Search either your stack or your heap for 1 program. <em>(Shuffle your stack after searching it.)</em> Install that program, ignoring all costs. When your turn ends, if that program has not been uninstalled, add it to the top of your stack.",
  "title": "Test Run"
}
