{
  "card_type_id": "hardware",
  "cost": 2,
  "deck_limit": 3,
  "designed_by": "null_signal_games",
  "faction_id": "criminal",
  "id": "boomerang",
  "influence_cost": 2,
  "is_unique": true,
  "side_id": "runner",
  "stripped_text": "When you install this hardware, choose 1 installed piece of ice. Use this hardware only during encounters with that ice. trash: Break up to 2 subroutines. When this run ends, if it was successful, you may shuffle 1 copy of Boomerang from your heap into your stack.",
  "stripped_title": "Boomerang",
  "text": "When you install this hardware, choose 1 installed piece of ice. Use this hardware only during encounters with that ice.\n<strong>[trash]:</strong> Break up to 2 subroutines. When this run ends, if it was successful, you may shuffle 1 copy of Boomerang from your heap into your stack.",
  "title": "Boomerang"
}
