{
  "card_type_id": "program",
  "cost": 0,
  "deck_limit": 3,
  "designed_by": "fantasy_flight_games",
  "faction_id": "shaper",
  "id": "ika",
  "influence_cost": 2,
  "is_unique": false,
  "memory_cost": 1,
  "side_id": "runner",
  "strength": 2,
  "stripped_text": "2 credits: Host this program on a piece of ice. Interface -> 1 credit: Break up to 2 subroutines on host sentry. 2 credits: +3 strength.",
  "stripped_title": "Ika",
  "subtypes": ["icebreaker", "killer", "trojan"],
  "text": "<strong>2[credit]:</strong> Host this program on a piece of ice.\nInterface â†’ <strong>1[credit]:</strong> Break up to 2 subroutines on host <strong>sentry</strong>.\n<strong>2[credit]:</strong> +3 strength.",
  "title": "Ika"
}
