{
  "card_type_id": "resource",
  "cost": 0,
  "deck_limit": 3,
  "designed_by": "fantasy_flight_games",
  "faction_id": "neutral_runner",
  "id": "investigator_inez_delgado_4",
  "influence_cost": 0,
  "is_unique": true,
  "layout_id": "normal",
  "side_id": "runner",
  "stripped_text": "Add Investigator Inez Delgado to your score area as an agenda worth 0 agenda points: Reveal each card in HQ and the top card of R&D. Use this only if you have stolean an agenda this turn.",
  "stripped_title": "Investigator Inez Delgado 4",
  "subtypes": ["connection"],
  "text": "<strong>Add Investigator Inez Delgado to your score area as an agenda worth 0 agenda points:</strong> Reveal each card in HQ and the top card of R&D. Use this only if you have stolean an agenda this turn.",
  "title": "Investigator Inez Delgado 4"
}
