{
  "base_link": 0,
  "card_type_id": "runner_identity",
  "deck_limit": 1,
  "designed_by": "fantasy_flight_games",
  "faction_id": "adam",
  "id": "adam_compulsive_hacker",
  "influence_limit": 25,
  "is_unique": false,
  "minimum_deck_size": 45,
  "side_id": "runner",
  "stripped_text": "You start the game with 3 different directive cards installed (these cards are not considered part of your deck).",
  "stripped_title": "Adam: Compulsive Hacker",
  "subtypes": ["bioroid"],
  "text": "You start the game with 3 different <strong>directive</strong> cards installed (these cards are not considered part of your deck).",
  "title": "Adam: Compulsive Hacker"
}
