{
  "card_type_id": "program",
  "cost": 0,
  "deck_limit": 3,
  "designed_by": "fantasy_flight_games",
  "faction_id": "criminal",
  "id": "tracker",
  "influence_cost": 2,
  "is_unique": false,
  "memory_cost": 2,
  "side_id": "runner",
  "stripped_text": "When your turn begins, you may choose a server. click, 2 credits: Run the chosen server. The first time a subroutine would resolve during that run, prevent it from resolving.",
  "stripped_title": "Tracker",
  "text": "When your turn begins, you may choose a server.\n<strong>[click]</strong>, <strong>2[credit]:</strong> Run the chosen server. The first time a subroutine would resolve during that run, prevent it from resolving.",
  "title": "Tracker"
}
