{
  "card_type_id": "upgrade",
  "cost": 1,
  "deck_limit": 3,
  "designed_by": "null_signal_games",
  "faction_id": "jinteki",
  "id": "letheia_nisei",
  "influence_cost": 3,
  "is_unique": true,
  "side_id": "corp",
  "stripped_text": "The first time the Runner approaches this server during each run, play a Psi Game. (Players secretly bid 0-2 credits. Then each player reveals and spends their bid.) If the bids differ, you may trash this upgrade. If you do, the Runner moves to the outermost position of this server. They may jack out.",
  "stripped_title": "Letheia Nisei",
  "subtypes": ["psi", "clone"],
  "text": "The first time the Runner approaches this server during each run, play a Psi Game. <em>(Players secretly bid 0â€“2[credit]. Then each player reveals and spends their bid.)</em> If the bids differ, you may trash this upgrade. If you do, the Runner moves to the outermost position of this server. They may jack out.",
  "title": "Letheia Nisei",
  "trash_cost": 2
}
