{
  "card_type_id": "ice",
  "cost": 2,
  "deck_limit": 3,
  "designed_by": "fantasy_flight_games",
  "faction_id": "haas_bioroid",
  "id": "gyri_labyrinth",
  "influence_cost": 2,
  "is_unique": false,
  "side_id": "corp",
  "strength": 2,
  "stripped_text": "Subroutine The Runner's maximum hand size is reduced by 2 until the beginning of the Corp's next turn.",
  "stripped_title": "Gyri Labyrinth",
  "subtypes": ["code_gate"],
  "text": "[subroutine] The Runner's maximum hand size is reduced by 2 until the beginning of the Corp's next turn.",
  "title": "Gyri Labyrinth"
}
