{
  "card_type_id": "operation",
  "cost": 2,
  "deck_limit": 3,
  "designed_by": "fantasy_flight_games",
  "faction_id": "neutral_corp",
  "id": "rover_algorithm",
  "influence_cost": 0,
  "is_unique": false,
  "side_id": "corp",
  "stripped_text": "Install Rover Algorithm on a rezzed piece of ice as a hosted condition counter with the text \"Host ice has +1 strength for each power counter on Rover Algorithm. Whenever the Runner passes host ice, place 1 power counter on Rover Algorithm.\"",
  "stripped_title": "Rover Algorithm",
  "text": "Install Rover Algorithm on a rezzed piece of ice as a hosted condition counter with the text \"Host ice has +1 strength for each power counter on Rover Algorithm. Whenever the Runner passes host ice, place 1 power counter on Rover Algorithm.\"",
  "title": "Rover Algorithm"
}
